{
  "comparison_kind": "direct_s3_pin_correction_from_pft_development_evidence",
  "comparison_lane": {
    "flyspeck_commit": "2ea440e9f7c55734d1e47738e44a6129ce0ecf5a",
    "inventory_findings_sha256": "29bf0bf9bb9c23b0ba4e77b271e1fc82282023c16e703dcd0cb5ac027a5e75e7",
    "project_git_commit": "5d620bcdd3412f3e4a9ed3d9dcb3ed9ae71c22ff",
    "role": "pft_development_prior_inventory",
    "totals": {
      "findings": 6049,
      "lexical_notes": 1,
      "source_bytes_scanned": 100751549,
      "source_files_scanned": 1347
    }
  },
  "contract_sha256": "7a5dec1222048bbce2dcfc2a190fd5d0f4945e9c3a8dd4339eb0eb4b6002423f",
  "delta": {
    "by_category": {
      "ffi.custom_call": {
        "comparison": 2,
        "selected": 0,
        "selected_minus_comparison": -2
      },
      "ffi.ocaml_external_declaration": {
        "comparison": 0,
        "selected": 0,
        "selected_minus_comparison": 0
      },
      "module.declaration_alias": {
        "comparison": 5,
        "selected": 6,
        "selected_minus_comparison": 1
      },
      "module.declaration_first_class_unpack": {
        "comparison": 0,
        "selected": 0,
        "selected_minus_comparison": 0
      },
      "module.declaration_functor": {
        "comparison": 1,
        "selected": 1,
        "selected_minus_comparison": 0
      },
      "module.declaration_other": {
        "comparison": 39,
        "selected": 39,
        "selected_minus_comparison": 0
      },
      "module.declaration_structure": {
        "comparison": 605,
        "selected": 611,
        "selected_minus_comparison": 6
      },
      "module.first_class_pack": {
        "comparison": 0,
        "selected": 0,
        "selected_minus_comparison": 0
      },
      "module.first_class_unpack": {
        "comparison": 0,
        "selected": 0,
        "selected_minus_comparison": 0
      },
      "module.include": {
        "comparison": 95,
        "selected": 95,
        "selected_minus_comparison": 0
      },
      "module.type_declaration": {
        "comparison": 65,
        "selected": 65,
        "selected_minus_comparison": 0
      },
      "open.declaration": {
        "comparison": 4926,
        "selected": 4925,
        "selected_minus_comparison": -1
      },
      "open.local_let": {
        "comparison": 3,
        "selected": 3,
        "selected_minus_comparison": 0
      },
      "open.local_parenthesized": {
        "comparison": 91,
        "selected": 89,
        "selected_minus_comparison": -2
      },
      "pointer_equality.infix_use": {
        "comparison": 210,
        "selected": 232,
        "selected_minus_comparison": 22
      },
      "pointer_equality.operator_binding": {
        "comparison": 4,
        "selected": 4,
        "selected_minus_comparison": 0
      },
      "pointer_equality.operator_reference": {
        "comparison": 3,
        "selected": 4,
        "selected_minus_comparison": 1
      }
    },
    "by_repository": {
      "candle": {
        "comparison": 954,
        "selected": 984,
        "selected_minus_comparison": 30
      },
      "flyspeck": {
        "comparison": 5095,
        "selected": 5090,
        "selected_minus_comparison": -5
      }
    },
    "totals": {
      "findings": {
        "comparison": 6049,
        "selected": 6074,
        "selected_minus_comparison": 25
      },
      "lexical_notes": {
        "comparison": 1,
        "selected": 1,
        "selected_minus_comparison": 0
      },
      "source_bytes_scanned": {
        "comparison": 100751549,
        "selected": 100859921,
        "selected_minus_comparison": 108372
      },
      "source_files_scanned": {
        "comparison": 1347,
        "selected": 1364,
        "selected_minus_comparison": 17
      }
    }
  },
  "eligible_source_path_delta_comparison_to_selected": [
    {
      "path": "formal_lp/hypermap/verify_all.hl",
      "status": "M"
    },
    {
      "path": "load_flyspeck.ml",
      "status": "M"
    },
    {
      "path": "text_formalization/build/strictbuild.hl",
      "status": "M"
    },
    {
      "path": "text_formalization/candle/basics_length3_leaf.hl",
      "status": "D"
    },
    {
      "path": "text_formalization/candle/export_basics_length3.hl",
      "status": "D"
    },
    {
      "path": "text_formalization/candle/export_full_targets.hl",
      "status": "D"
    },
    {
      "path": "text_formalization/candle/export_hol_library.hl",
      "status": "D"
    },
    {
      "path": "text_formalization/candle/export_main_targets.hl",
      "status": "D"
    },
    {
      "path": "text_formalization/candle/export_refinement_leaves.hl",
      "status": "D"
    },
    {
      "path": "text_formalization/candle/export_restartable_build.hl",
      "status": "D"
    },
    {
      "path": "text_formalization/candle/vukhacky_real_leaf.hl",
      "status": "D"
    },
    {
      "path": "text_formalization/nonlinear/mk_all_ineq.hl",
      "status": "M"
    }
  ],
  "evidence_boundary": "This artifact compares source inventory and reviewed triage records. It does not promote PFT-only sources into the selected S3 route or prove dynamic reachability or semantic compatibility.",
  "reproducible_command": "scripts/update-compatibility-inventory.sh /project/repos",
  "schema_version": 1,
  "selected_lane": {
    "flyspeck_commit": "1ce0353008eba83d3c76ae9a25c3c242e4802d53",
    "inventory_findings_sha256": "8095917929b90b2edcbd8afb87d21ab8b0c96614ff894b94feb920a1540eca82",
    "inventory_path_key": "../worktrees/flyspeck-v13-source",
    "role": "direct_s3_clean_upstream",
    "totals": {
      "findings": 6074,
      "lexical_notes": 1,
      "source_bytes_scanned": 100859921,
      "source_files_scanned": 1364
    }
  },
  "stable_occurrences": {
    "comparison_only": 114,
    "comparison_only_records": [
      {
        "category": "open.local_parenthesized",
        "lexeme": "A.(",
        "location": {
          "column": 7,
          "end_column": 10,
          "end_line": 444,
          "line": 444
        },
        "repository": "candle",
        "source_path": "Library/bitmatch.ml"
      },
      {
        "category": "open.local_parenthesized",
        "lexeme": "A.(",
        "location": {
          "column": 10,
          "end_column": 13,
          "end_line": 452,
          "line": 452
        },
        "repository": "candle",
        "source_path": "Library/bitmatch.ml"
      },
      {
        "category": "open.local_parenthesized",
        "lexeme": "A.(",
        "location": {
          "column": 10,
          "end_column": 13,
          "end_line": 454,
          "line": 454
        },
        "repository": "candle",
        "source_path": "Library/bitmatch.ml"
      },
      {
        "category": "open.local_parenthesized",
        "lexeme": "A.(",
        "location": {
          "column": 9,
          "end_column": 12,
          "end_line": 773,
          "line": 773
        },
        "repository": "candle",
        "source_path": "Library/bitmatch.ml"
      },
      {
        "category": "open.local_parenthesized",
        "lexeme": "Term.(",
        "location": {
          "column": 22,
          "end_column": 28,
          "end_line": 1020,
          "line": 1020
        },
        "repository": "candle",
        "source_path": "Library/grouptheory.ml"
      },
      {
        "category": "open.local_parenthesized",
        "lexeme": "Term.(",
        "location": {
          "column": 16,
          "end_column": 22,
          "end_line": 1058,
          "line": 1058
        },
        "repository": "candle",
        "source_path": "Library/grouptheory.ml"
      },
      {
        "category": "open.local_parenthesized",
        "lexeme": "Term.(",
        "location": {
          "column": 6,
          "end_column": 12,
          "end_line": 4908,
          "line": 4908
        },
        "repository": "candle",
        "source_path": "Library/ringtheory.ml"
      },
      {
        "category": "open.local_parenthesized",
        "lexeme": "Term.(",
        "location": {
          "column": 69,
          "end_column": 75,
          "end_line": 764,
          "line": 764
        },
        "repository": "candle",
        "source_path": "Multivariate/clifford.ml"
      },
      {
        "category": "open.local_parenthesized",
        "lexeme": "Term.(",
        "location": {
          "column": 44,
          "end_column": 50,
          "end_line": 832,
          "line": 832
        },
        "repository": "candle",
        "source_path": "Multivariate/clifford.ml"
      },
      {
        "category": "open.local_parenthesized",
        "lexeme": "Term.(",
        "location": {
          "column": 4,
          "end_column": 10,
          "end_line": 688,
          "line": 688
        },
        "repository": "candle",
        "source_path": "Multivariate/complexes.ml"
      },
      {
        "category": "open.local_parenthesized",
        "lexeme": "Term.(",
        "location": {
          "column": 23,
          "end_column": 29,
          "end_line": 877,
          "line": 877
        },
        "repository": "candle",
        "source_path": "Multivariate/complexes.ml"
      },
      {
        "category": "open.local_parenthesized",
        "lexeme": "Term.(",
        "location": {
          "column": 20,
          "end_column": 26,
          "end_line": 12084,
          "line": 12084
        },
        "repository": "candle",
        "source_path": "Multivariate/metric.ml"
      },
      {
        "category": "open.local_parenthesized",
        "lexeme": "Term.(",
        "location": {
          "column": 14,
          "end_column": 20,
          "end_line": 881,
          "line": 881
        },
        "repository": "candle",
        "source_path": "Multivariate/vectors.ml"
      },
      {
        "category": "open.local_parenthesized",
        "lexeme": "Term.(",
        "location": {
          "column": 19,
          "end_column": 25,
          "end_line": 884,